,Name (Specialty),AHA ID,Hospital ID,Specialty ID,Specialty Score,Specialty Ranking,Specialty Ranking Tied?,Specialty Ranking Revoked?,Specialty Ranking Type,Updated
233,Cleveland Clinic Fairview Hospital,6410710,6410710,IHQCANC,36.9/100,,,,adult,2023-01-04 20:29:21.680567
234,Inova Alexandria Hospital,6340020,6340020,IHQCANC,36.9/100,,,,adult,2023-01-04 20:29:21.680567
235,Spectrum Health-Butterworth and Blodgett Campuses,6440021,6440021,IHQCANC,36.9/100,,,,adult,2023-01-04 20:29:21.680567
236,St. Peter's Hospital-Albany,6210070,6210070,IHQCANC,36.9/100,,,,adult,2023-01-04 20:29:21.680567
237,Trinity Health Ann Arbor Hospital,6440087,6440087,IHQCANC,36.9/100,,,,adult,2023-01-04 20:29:21.680567
238,Trinity Health Grand Rapids Hospital,6441210,6441210,IHQCANC,36.9/100,,,,adult,2023-01-04 20:29:21.680567
239,Beaumont Hospital-Troy,6442463,6442463,IHQCANC,36.8/100,,,,adult,2023-01-04 20:29:21.680567
240,Bridgeport Hospital,6160002,6160002,IHQCANC,36.8/100,,,,adult,2023-01-04 20:29:21.680567
241,Sanford USD Medical Center,6650007,6650007,IHQCANC,36.8/100,,,,adult,2023-01-04 20:29:21.680567
242,OhioHealth Grant Medical Center,6411010,6411010,IHQCANC,36.7/100,,,,adult,2023-01-04 20:29:21.680567
243,St. Luke's Hospital-Chesterfield,6630075,6630075,IHQCANC,36.7/100,,,,adult,2023-01-04 20:29:21.680567
244,Texas Health Presbyterian Hospital Plano,6740945,6740945,IHQCANC,36.7/100,,,,adult,2023-01-04 20:29:21.680567
245,Overlook Medical Center,6221370,6221370,IHQCANC,36.6/100,,,,adult,2023-01-04 20:29:21.680567
246,Sinai Hospital of Baltimore,6320280,6320280,IHQCANC,36.6/100,,,,adult,2023-01-04 20:29:21.680567
247,Virtua Voorhees Hospital,6221600,6221600,IHQCANC,36.6/100,,,,adult,2023-01-04 20:29:21.680567
248,Albany Medical Center,6210030,6210030,IHQCANC,36.5/100,,,,adult,2023-01-04 20:29:21.680567
249,Good Samaritan University Hospital,6215295,6215295,IHQCANC,36.5/100,,,,adult,2023-01-04 20:29:21.680567
250,Elmhurst Hospital,6431620,6431620,IHQCANC,36.4/100,,,,adult,2023-01-04 20:29:21.680567
251,UCHealth Medical Center of the Rockies,6840033,6840033,IHQCANC,36.4/100,,,,adult,2023-01-04 20:29:21.680567
252,University Hospital-Augusta,6380270,6380270,IHQCANC,36.4/100,,,,adult,2023-01-04 20:29:21.680567
253,Baptist Health Floyd,6421045,6421045,IHQCANC,36.2/100,,,,adult,2023-01-04 20:29:21.680567
254,Christian Hospital,6630185,6630185,IHQCANC,36.2/100,,,,adult,2023-01-04 20:29:21.680567
255,John H. Stroger Jr. Hospital of Cook County,6430600,6430600,IHQCANC,36.2/100,,,,adult,2023-01-04 20:29:21.680567
256,Ascension St. John Hospital,6440805,6440805,IHQCANC,36.1/100,,,,adult,2023-01-04 20:29:21.680567
257,Community Hospital of the Monterey Peninsula,6930385,6930385,IHQCANC,36.1/100,,,,adult,2023-01-04 20:29:21.680567
258,Grady Memorial Hospital,6380130,6380130,IHQCANC,36.1/100,,,,adult,2023-01-04 20:29:21.680567
259,Huntington Hospital at Northwell Health,6211880,6211880,IHQCANC,36.1/100,,,,adult,2023-01-04 20:29:21.680567
260,OhioHealth Riverside Methodist Hospital,6411110,6411110,IHQCANC,36.1/100,,,,adult,2023-01-04 20:29:21.680567
261,PIH Health Good Samaritan Hospital,6931540,6931540,IHQCANC,36.1/100,,,,adult,2023-01-04 20:29:21.680567
262,TidalHealth Peninsula Regional Hospital,6320785,6320785,IHQCANC,36.0/100,,,,adult,2023-01-04 20:29:21.680567
263,Prisma Health Greenville Memorial Hospital,6370323,6370323,IHQCANC,35.9/100,,,,adult,2023-01-04 20:29:21.680567
264,Providence St. Vincent Medical Center,6920540,6920540,IHQCANC,35.9/100,,,,adult,2023-01-04 20:29:21.680567
265,Renown Regional Medical Center,6880130,6880130,IHQCANC,35.9/100,,,,adult,2023-01-04 20:29:21.680567
266,St. Joseph's University Medical Center,6221120,6221120,IHQCANC,35.9/100,,,,adult,2023-01-04 20:29:21.680567
267,Ascension Seton Medical Center Austin,6740200,6740200,IHQCANC,35.8/100,,,,adult,2023-01-04 20:29:21.680567
268,Mount Carmel St. Ann's Hospital,6411060,6411060,IHQCANC,35.8/100,,,,adult,2023-01-04 20:29:21.680567
269,Swedish Hospital,6431180,6431180,IHQCANC,35.8/100,,,,adult,2023-01-04 20:29:21.680567
270,Tulane Health System-New Orleans,6720032,6720032,IHQCANC,35.8/100,,,,adult,2023-01-04 20:29:21.680567
271,Ascension Providence Rochester Hospital,6442198,6442198,IHQCANC,35.7/100,,,,adult,2023-01-04 20:29:21.680567
272,Holy Name Medical Center,6221390,6221390,IHQCANC,35.7/100,,,,adult,2023-01-04 20:29:21.680567
273,UCHealth Memorial Hospital,6840190,6840190,IHQCANC,35.6/100,,,,adult,2023-01-04 20:29:21.680567
274,Littleton Adventist Hospital,6840805,6840805,IHQCANC,35.5/100,,,,adult,2023-01-04 20:29:21.680567
275,UPMC Western Maryland,6320206,6320206,IHQCANC,35.5/100,,,,adult,2023-01-04 20:29:21.680567
276,Geisinger Medical Center,6230550,6230550,IHQCANC,35.4/100,,,,adult,2023-01-04 20:29:21.680567
277,Houston Methodist Sugar Land Hospital,6740138,6740138,IHQCANC,35.3/100,,,,adult,2023-01-04 20:29:21.680567
278,Mount Sinai South Nassau Hospital,6213735,6213735,IHQCANC,35.3/100,,,,adult,2023-01-04 20:29:21.680567
279,Northwest Community Hospital,6432485,6432485,IHQCANC,35.3/100,,,,adult,2023-01-04 20:29:21.680567
280,Sharp Grossmont Hospital,6930887,6930887,IHQCANC,35.3/100,,,,adult,2023-01-04 20:29:21.680567
281,UPMC Hamot,6230760,6230760,IHQCANC,35.3/100,,,,adult,2023-01-04 20:29:21.680567
282,Vassar Brothers Medical Center,6214140,6214140,IHQCANC,35.3/100,,,,adult,2023-01-04 20:29:21.680567
283,Ascension Macomb-Oakland Hospital,6440489,6440489,IHQCANC,35.2/100,,,,adult,2023-01-04 20:29:21.680567
284,Intermountain Medical Center,6870141,6870141,IHQCANC,35.2/100,,,,adult,2023-01-04 20:29:21.680567
285,Mayo Clinic Eau Claire,6450310,6450310,IHQCANC,35.2/100,,,,adult,2023-01-04 20:29:21.680567
286,Medical Center of Aurora,6840014,6840014,IHQCANC,35.2/100,,,,adult,2023-01-04 20:29:21.680567
287,Monmouth Medical Center-Long Branch Campus,6220560,6220560,IHQCANC,35.2/100,,,,adult,2023-01-04 20:29:21.680567
288,South Shore University Hospital at Northwell Health,6210280,6210280,IHQCANC,35.2/100,,,,adult,2023-01-04 20:29:21.680567
289,Sparks Regional Medical Center,6710220,6710220,IHQCANC,35.2/100,,,,adult,2023-01-04 20:29:21.680567
290,UPMC Harrisburg,6230039,6230039,IHQCANC,35.1/100,,,,adult,2023-01-04 20:29:21.680567
291,Huntington Hospital,6932350,6932350,IHQCANC,35.0/100,,,,adult,2023-01-04 20:29:21.680567
292,Methodist Hospital of Southern California,6931630,6931630,IHQCANC,35.0/100,,,,adult,2023-01-04 20:29:21.680567
293,Methodist Hospital-San Antonio,6743122,6743122,IHQCANC,35.0/100,,,,adult,2023-01-04 20:29:21.680567
294,University of Cincinnati Medical Center,6410435,6410435,IHQCANC,35.0/100,,,,adult,2023-01-04 20:29:21.680567
295,Valley Hospital,6221235,6221235,IHQCANC,35.0/100,,,,adult,2023-01-04 20:29:21.680567
296,Englewood Hospital,6220280,6220280,IHQCANC,34.9/100,,,,adult,2023-01-04 20:29:21.680567
297,Parkview Regional Medical Center,6429153,6429153,IHQCANC,34.9/100,,,,adult,2023-01-04 20:29:21.680567
298,Santa Barbara Cottage Hospital,6933375,6933375,IHQCANC,34.9/100,,,,adult,2023-01-04 20:29:21.680567
299,Ascension St. Vincent Hospital,6420715,6420715,IHQCANC,34.8/100,,,,adult,2023-01-04 20:29:21.680567
300,Bethesda North Hospital,6410382,6410382,IHQCANC,34.8/100,,,,adult,2023-01-04 20:29:21.680567
301,Johns Hopkins Medicine-Sibley Memorial Hospital,6330210,6330210,IHQCANC,34.8/100,,,,adult,2023-01-04 20:29:21.680567
302,Saratoga Hospital,6214520,6214520,IHQCANC,34.8/100,,,,adult,2023-01-04 20:29:21.680567
303,St. David's Medical Center,6740190,6740190,IHQCANC,34.8/100,,,,adult,2023-01-04 20:29:21.680567
304,St. Joseph's Hospital and Medical Center,6860280,6860280,IHQCANC,34.8/100,,,,adult,2023-01-04 20:29:21.680567
305,Memorial Hermann Memorial City Medical Center,6741970,6741970,IHQCANC,34.6/100,,,,adult,2023-01-04 20:29:21.680567
306,UCHealth Poudre Valley Hospital,6840018,6840018,IHQCANC,34.6/100,,,,adult,2023-01-04 20:29:21.680567
307,Johns Hopkins Medicine-Suburban Hospital,6320350,6320350,IHQCANC,34.5/100,,,,adult,2023-01-04 20:29:21.680567
308,Baystate Medical Center,6141955,6141955,IHQCANC,34.4/100,,,,adult,2023-01-04 20:29:21.680567
309,Ocean University Medical Center at Hackensack Meridian Health,6221170,6221170,IHQCANC,34.4/100,,,,adult,2023-01-04 20:29:21.680567
310,Willis-Knighton Medical Center,6720877,6720877,IHQCANC,34.4/100,,,,adult,2023-01-04 20:29:21.680567
311,Bronson Methodist Hospital,6441550,6441550,IHQCANC,34.3/100,,,,adult,2023-01-04 20:29:21.680567
312,Carilion Roanoke Memorial Hospital,6341040,6341040,IHQCANC,34.3/100,,,,adult,2023-01-04 20:29:21.680567
313,Kaiser Permanente Moanalua Medical Center,6950330,6950330,IHQCANC,34.3/100,,,,adult,2023-01-04 20:29:21.680567
314,Los Alamitos Medical Center,693139A,693139A,IHQCANC,34.3/100,,,,adult,2023-01-04 20:29:21.680567
315,Main Line Health Bryn Mawr Hospital,6230260,6230260,IHQCANC,34.3/100,,,,adult,2023-01-04 20:29:21.680567
316,Banner Desert Medical Center,6860016,6860016,IHQCANC,34.2/100,,,,adult,2023-01-04 20:29:21.680567
317,Jackson Memorial Hospital,6390573,6390573,IHQCANC,34.1/100,,,,adult,2023-01-04 20:29:21.680567
318,St. Joseph's Hospital-Tampa,6390053,6390053,IHQCANC,34.1/100,,,,adult,2023-01-04 20:29:21.680567
319,University of Maryland Baltimore Washington Medical Center,6320569,6320569,IHQCANC,34.1/100,,,,adult,2023-01-04 20:29:21.680567
320,Christus Southeast Texas Hospital-St. Elizabeth,6740258,6740258,IHQCANC,33.9/100,,,,adult,2023-01-04 20:29:21.680567
321,East Jefferson General Hospital,6720418,6720418,IHQCANC,33.9/100,,,,adult,2023-01-04 20:29:21.680567
322,St. Mary's Regional Medical Center-Reno,6880110,6880110,IHQCANC,33.9/100,,,,adult,2023-01-04 20:29:21.680567
323,Legacy Good Samaritan Medical Center,6920418,6920418,IHQCANC,33.8/100,,,,adult,2023-01-04 20:29:21.680567
324,Moses H. Cone Memorial Hospital,6360002,6360002,IHQCANC,33.8/100,,,,adult,2023-01-04 20:29:21.680567
325,Overlake Medical Center and Clinics,6910060,6910060,IHQCANC,33.8/100,,,,adult,2023-01-04 20:29:21.680567
326,Baptist Medical Center Jacksonville,6390308,6390308,IHQCANC,33.7/100,,,,adult,2023-01-04 20:29:21.680567
327,Kaiser Permanente Anaheim and Irvine Medical Centers,6930075,6930075,IHQCANC,33.7/100,,,,adult,2023-01-04 20:29:21.680567
328,Northern Westchester Hospital at Northwell Health,6212500,6212500,IHQCANC,33.7/100,,,,adult,2023-01-04 20:29:21.680567
329,South Shore Hospital-South Weymouth,6141900,6141900,IHQCANC,33.7/100,,,,adult,2023-01-04 20:29:21.680567
330,Texas Health Harris Methodist Hospital Fort Worth,6741440,6741440,IHQCANC,33.7/100,,,,adult,2023-01-04 20:29:21.680567
331,Mount Sinai Medical Center,6390640,6390640,IHQCANC,33.6/100,,,,adult,2023-01-04 20:29:21.680567
332,Northwestern Medicine Palos Hospital,6431060,6431060,IHQCANC,33.6/100,,,,adult,2023-01-04 20:29:21.680567
333,Scripps Memorial Hospital-Encinitas,6930648,6930648,IHQCANC,33.6/100,,,,adult,2023-01-04 20:29:21.680567
334,Doctors Hospital at Renaissance,6740232,6740232,IHQCANC,33.5/100,,,,adult,2023-01-04 20:29:21.680567
335,MemorialCare Saddleback Medical Center,6930272,6930272,IHQCANC,33.5/100,,,,adult,2023-01-04 20:29:21.680567
336,Mercy Health-Fairfield Hospital,6410855,6410855,IHQCANC,33.5/100,,,,adult,2023-01-04 20:29:21.680567
337,New York-Presbyterian Queens Hospital,6211595,6211595,IHQCANC,33.5/100,,,,adult,2023-01-04 20:29:21.680567
338,Our Lady of the Lake Regional Medical Center,6720028,6720028,IHQCANC,33.5/100,,,,adult,2023-01-04 20:29:21.680567
339,St. Luke's Regional Medical Center,6820050,6820050,IHQCANC,33.5/100,,,,adult,2023-01-04 20:29:21.680567
340,St. Mary's Medical Center-Huntington,6350400,6350400,IHQCANC,33.5/100,,,,adult,2023-01-04 20:29:21.680567
341,MultiCare Tacoma General Hospital,6911018,6911018,IHQCANC,33.4/100,,,,adult,2023-01-04 20:29:21.680567
342,St. Alphonsus Regional Medical Center,6820040,6820040,IHQCANC,33.4/100,,,,adult,2023-01-04 20:29:21.680567
343,AdventHealth Hinsdale,6431920,6431920,IHQCANC,33.3/100,,,,adult,2023-01-04 20:29:21.680567
344,Allegheny General Hospital,6230041,6230041,IHQCANC,33.3/100,,,,adult,2023-01-04 20:29:21.680567
345,Ascension Alexian Brothers Hospital,6431613,6431613,IHQCANC,33.3/100,,,,adult,2023-01-04 20:29:21.680567
346,Christus Mother Frances Hospital-Tyler,6743570,6743570,IHQCANC,33.3/100,,,,adult,2023-01-04 20:29:21.680567
347,Lahey Hospital and Medical Center,6140690,6140690,IHQCANC,33.3/100,,,,adult,2023-01-04 20:29:21.680567
348,Menorah Medical Center,6670020,6670020,IHQCANC,33.3/100,,,,adult,2023-01-04 20:29:21.680567
349,Mercy San Juan Medical Center,6930037,6930037,IHQCANC,33.3/100,,,,adult,2023-01-04 20:29:21.680567
350,Summa Health-Akron Campus,6410012,6410012,IHQCANC,33.3/100,,,,adult,2023-01-04 20:29:21.680567
351,Virginia Mason Franciscan Health-St. Joseph Medical Center,6911060,6911060,IHQCANC,33.3/100,,,,adult,2023-01-04 20:29:21.680567
352,Indiana University Health Arnett Hospital,6420076,6420076,IHQCANC,33.2/100,,,,adult,2023-01-04 20:29:21.680567
353,JFK University Medical Center at Hackensack Meridian Health,6220247,6220247,IHQCANC,33.2/100,,,,adult,2023-01-04 20:29:21.680567
354,Legacy Meridian Park Medical Center,6920805,6920805,IHQCANC,33.2/100,,,,adult,2023-01-04 20:29:21.680567
355,Sarasota Memorial Hospital,6390052,6390052,IHQCANC,33.2/100,,,,adult,2023-01-04 20:29:21.680567
356,The University of Tennessee Medical Center,6520575,6520575,IHQCANC,33.2/100,,,,adult,2023-01-04 20:29:21.680567
357,University of Maryland St. Joseph Medical Center,6320260,6320260,IHQCANC,33.2/100,,,,adult,2023-01-04 20:29:21.680567
358,Mississippi Baptist Medical Center,6540007,6540007,IHQCANC,33.1/100,,,,adult,2023-01-04 20:29:21.680567
359,Danbury Hospital,6160100,6160100,IHQCANC,33.0/100,,,,adult,2023-01-04 20:29:21.680567
360,Mercy Hospital St. Louis,6631165,6631165,IHQCANC,33.0/100,,,,adult,2023-01-04 20:29:21.680567
361,MercyOne Des Moines Medical Center,6620003,6620003,IHQCANC,33.0/100,,,,adult,2023-01-04 20:29:21.680567
362,Banner Thunderbird Medical Center,6860013,6860013,IHQCANC,32.9/100,,,,adult,2023-01-04 20:29:21.680567
363,Bayhealth Kent General Hospital,6310007,6310007,IHQCANC,32.9/100,,,,adult,2023-01-04 20:29:21.680567
364,Lafayette General Medical Center,6720340,6720340,IHQCANC,32.9/100,,,,adult,2023-01-04 20:29:21.680567
365,Ochsner LSU Health Shreveport  Academic Medical Center,6720776,6720776,IHQCANC,32.9/100,,,,adult,2023-01-04 20:29:21.680567
366,Riverview Medical Center at Hackensack Meridian Health,6221220,6221220,IHQCANC,32.9/100,,,,adult,2023-01-04 20:29:21.680567
367,Winchester Medical Center,6341200,6341200,IHQCANC,32.9/100,,,,adult,2023-01-04 20:29:21.680567
368,Aurora West Allis Medical Center,6452165,6452165,IHQCANC,32.8/100,,,,adult,2023-01-04 20:29:21.680567
369,White Plains Hospital,6215330,6215330,IHQCANC,32.8/100,,,,adult,2023-01-04 20:29:21.680567
370,Chippenham and Johnston-Willis Hospitals,6340009,6340009,IHQCANC,32.7/100,,,,adult,2023-01-04 20:29:21.680567
371,Miami Valley Hospital,6411190,6411190,IHQCANC,32.7/100,,,,adult,2023-01-04 20:29:21.680567
372,Winchester Hospital,6142280,6142280,IHQCANC,32.7/100,,,,adult,2023-01-04 20:29:21.680567
373,Auxilio Mutuo Hospital,6040155,6040155,IHQCANC,32.6/100,,,,adult,2023-01-04 20:29:21.680567
374,Edward Cancer Center,6432350,6432350,IHQCANC,32.6/100,,,,adult,2023-01-04 20:29:21.680567
375,Kaiser Permanente Oakland and Richmond Medical Centers,6930067,6930067,IHQCANC,32.6/100,,,,adult,2023-01-04 20:29:21.680567
376,Texas Health Presbyterian Hospital Dallas,6741050,6741050,IHQCANC,32.6/100,,,,adult,2023-01-04 20:29:21.680567
377,Newark Beth Israel Medical Center,6220820,6220820,IHQCANC,32.5/100,,,,adult,2023-01-04 20:29:21.680567
378,Cooper University Health Care-Camden,6220190,6220190,IHQCANC,32.4/100,,,,adult,2023-01-04 20:29:21.680567
379,Enloe Medical Center,6930096,6930096,IHQCANC,32.4/100,,,,adult,2023-01-04 20:29:21.680567
380,Reading Hospital,6233443,6233443,IHQCANC,32.4/100,,,,adult,2023-01-04 20:29:21.680567
381,SSM Health St. Louis University Hospital,6631020,6631020,IHQCANC,32.4/100,,,,adult,2023-01-04 20:29:21.680567
382,Centra Lynchburg General Hospital,6340013,6340013,IHQCANC,32.3/100,,,,adult,2023-01-04 20:29:21.680567
383,Boone Hospital Center,6630130,6630130,IHQCANC,32.2/100,,,,adult,2023-01-04 20:29:21.680567
384,Halifax Health Medical Center of Daytona Beach,6390056,6390056,IHQCANC,32.2/100,,,,adult,2023-01-04 20:29:21.680567
385,HCA Houston Healthcare Clear Lake,6740149,6740149,IHQCANC,32.2/100,,,,adult,2023-01-04 20:29:21.680567
386,Orlando Health-Orlando Regional Medical Center,6390695,6390695,IHQCANC,32.2/100,,,,adult,2023-01-04 20:29:21.680567
387,WellSpan York Hospital,6233550,6233550,IHQCANC,32.2/100,,,,adult,2023-01-04 20:29:21.680567
388,Cape Coral Hospital,6390068,6390068,IHQCANC,32.1/100,,,,adult,2023-01-04 20:29:21.680567
389,Kaiser Permanente Riverside Medical Center,6932605,6932605,IHQCANC,32.1/100,,,,adult,2023-01-04 20:29:21.680567
390,Houston Methodist West Hospital,6740878,6740878,IHQCANC,32.0/100,,,,adult,2023-01-04 20:29:21.680567
391,Jefferson Hospital-Jefferson Hills,6230979,6230979,IHQCANC,32.0/100,,,,adult,2023-01-04 20:29:21.680567
392,St. Luke's Cornwall Hospital,6210037,6210037,IHQCANC,32.0/100,,,,adult,2023-01-04 20:29:21.680567
393,St. Peter's University Hospital,6220950,6220950,IHQCANC,32.0/100,,,,adult,2023-01-04 20:29:21.680567
394,Sanford Medical Center Bismarck,6640020,6640020,IHQCANC,31.9/100,,,,adult,2023-01-04 20:29:21.680567
395,Adventist Healthcare Shady Grove Medical Center,6320775,6320775,IHQCANC,31.8/100,,,,adult,2023-01-04 20:29:21.680567
396,Nebraska Methodist Hospital,6660710,6660710,IHQCANC,31.8/100,,,,adult,2023-01-04 20:29:21.680567
397,Norton Hospitals,6510488,6510488,IHQCANC,31.8/100,,,,adult,2023-01-04 20:29:21.680567
398,UnityPoint Health-Iowa Methodist Medical Center,6620420,6620420,IHQCANC,31.7/100,,,,adult,2023-01-04 20:29:21.680567
399,Jersey Shore University Medical Center at Hackensack Meridian Health,6220740,6220740,IHQCANC,31.6/100,,,,adult,2023-01-04 20:29:21.680567
400,Mercy General Hospital,6932670,6932670,IHQCANC,31.6/100,,,,adult,2023-01-04 20:29:21.680567
401,M Health Fairview Southdale Hospital,6610918,6610918,IHQCANC,31.6/100,,,,adult,2023-01-04 20:29:21.680567
402,Scripps Mercy Hospital,6932810,6932810,IHQCANC,31.6/100,,,,adult,2023-01-04 20:29:21.680567
403,St. Elizabeth Healthcare Edgewood-Covington Hospitals,6510110,6510110,IHQCANC,31.6/100,,,,adult,2023-01-04 20:29:21.680567
404,Cabell Huntington Hospital,6350345,6350345,IHQCANC,31.5/100,,,,adult,2023-01-04 20:29:21.680567
405,Creighton University Medical Center-Bergan Mercy,6660720,6660720,IHQCANC,31.5/100,,,,adult,2023-01-04 20:29:21.680567
406,Baylor Scott and White Medical Center-Plano,6740259,6740259,IHQCANC,31.4/100,,,,adult,2023-01-04 20:29:21.680567
407,CentraCare-St. Cloud Hospital,6611540,6611540,IHQCANC,31.4/100,,,,adult,2023-01-04 20:29:21.680567
408,Glens Falls Hospital,6211670,6211670,IHQCANC,31.4/100,,,,adult,2023-01-04 20:29:21.680567
409,North Kansas City Hospital,6630785,6630785,IHQCANC,31.4/100,,,,adult,2023-01-04 20:29:21.680567
410,Christ Hospital,6410430,6410430,IHQCANC,31.3/100,,,,adult,2023-01-04 20:29:21.680567
411,AdventHealth Tampa,6391103,6391103,IHQCANC,31.2/100,,,,adult,2023-01-04 20:29:21.680567
412,McLeod Regional Medical Center,6370009,6370009,IHQCANC,31.2/100,,,,adult,2023-01-04 20:29:21.680567
413,UPMC Magee-Womens Hospital,6232460,6232460,IHQCANC,31.2/100,,,,adult,2023-01-04 20:29:21.680567
414,Henry Ford Allegiance Health-Jackson,6441500,6441500,IHQCANC,31.1/100,,,,adult,2023-01-04 20:29:21.680567
415,Our Lady of Lourdes Regional Medical Center,6720343,6720343,IHQCANC,31.1/100,,,,adult,2023-01-04 20:29:21.680567
416,PIH Health Hospital-Whittier,6933885,6933885,IHQCANC,31.1/100,,,,adult,2023-01-04 20:29:21.680567
417,Baptist Health Lynn Cancer Institute at Boca Raton Regional Hospital,6390038,6390038,IHQCANC,31.0/100,,,,adult,2023-01-04 20:29:21.680567
418,Bon Secours Memorial Regional Medical Center,6340896,6340896,IHQCANC,31.0/100,,,,adult,2023-01-04 20:29:21.680567
419,University of Mississippi Medical Center,6540004,6540004,IHQCANC,31.0/100,,,,adult,2023-01-04 20:29:21.680567
420,FirstHealth Moore Regional Hospital,6361150,6361150,IHQCANC,30.9/100,,,,adult,2023-01-04 20:29:21.680567
421,St. David's North Austin Medical Center,6740093,6740093,IHQCANC,30.9/100,,,,adult,2023-01-04 20:29:21.680567
422,Ascension St. Vincent's Riverside Hospital,6390390,6390390,IHQCANC,30.8/100,,,,adult,2023-01-04 20:29:21.680567
423,Baptist Health Medical Center-Little Rock,6710335,6710335,IHQCANC,30.8/100,,,,adult,2023-01-04 20:29:21.680567
424,Baptist Health Lexington,6510407,6510407,IHQCANC,30.7/100,,,,adult,2023-01-04 20:29:21.680567
425,Gulf Coast Medical Center,6390323,6390323,IHQCANC,30.7/100,,,,adult,2023-01-04 20:29:21.680567
426,Mary Washington Hospital,6340290,6340290,IHQCANC,30.7/100,,,,adult,2023-01-04 20:29:21.680567
427,University of Vermont Medical Center,6130001,6130001,IHQCANC,30.7/100,,,,adult,2023-01-04 20:29:21.680567
428,AnMed Health Medical Center,6370030,6370030,IHQCANC,30.6/100,,,,adult,2023-01-04 20:29:21.680567
429,DMC Sinai-Grace Hospital,6440630,6440630,IHQCANC,30.6/100,,,,adult,2023-01-04 20:29:21.680567
430,Kaiser Permanente Los Angeles Medical Center,6930051,6930051,IHQCANC,30.6/100,,,,adult,2023-01-04 20:29:21.680567
431,Rapides Regional Medical Center,6720020,6720020,IHQCANC,30.6/100,,,,adult,2023-01-04 20:29:21.680567
432,Wilmot Cancer Institute,6214330,6214330,IHQCANC,30.6/100,,,,adult,2023-01-04 20:29:21.680567
433,Providence Sacred Heart Medical Center and Children's Hospital,6910980,6910980,IHQCANC,30.5/100,,,,adult,2023-01-04 20:29:21.680567
434,Amita Health St. Joseph Medical Center Joliet,6431990,6431990,IHQCANC,30.4/100,,,,adult,2023-01-04 20:29:21.680567
435,Bon Secours St. Mary's Hospital,6340921,6340921,IHQCANC,30.4/100,,,,adult,2023-01-04 20:29:21.680567
436,Morton Plant Hospital,6390090,6390090,IHQCANC,30.4/100,,,,adult,2023-01-04 20:29:21.680567
437,Santa Clara Valley Medical Center,6933240,6933240,IHQCANC,30.4/100,,,,adult,2023-01-04 20:29:21.680567
438,El Camino Health-Mountain View,6931392,6931392,IHQCANC,30.3/100,,,,adult,2023-01-04 20:29:21.680567
439,Regions Hospital,6611570,6611570,IHQCANC,30.3/100,,,,adult,2023-01-04 20:29:21.680567
440,RMC Anniston,6530070,6530070,IHQCANC,30.3/100,,,,adult,2023-01-04 20:29:21.680567
441,Sentara RMH Medical Center,6340340,6340340,IHQCANC,30.3/100,,,,adult,2023-01-04 20:29:21.680567
442,SSM Health DePaul Hospital-St. Louis,6630985,6630985,IHQCANC,30.3/100,,,,adult,2023-01-04 20:29:21.680567
443,St. Francis Hospital-Tulsa,6731215,6731215,IHQCANC,30.3/100,,,,adult,2023-01-04 20:29:21.680567
444,UnityPoint Health-St. Luke's Hospital,6620180,6620180,IHQCANC,30.3/100,,,,adult,2023-01-04 20:29:21.680567
445,Medical Center of Trinity,6398093,6398093,IHQCANC,30.2/100,,,,adult,2023-01-04 20:29:21.680567
446,SSM Health St. Mary's Hospital-St. Louis,6630995,6630995,IHQCANC,30.2/100,,,,adult,2023-01-04 20:29:21.680567
447,St. Anthony's Hospital,6390940,6390940,IHQCANC,30.2/100,,,,adult,2023-01-04 20:29:21.680567
448,Mather Hospital at Northwell Health,6214050,6214050,IHQCANC,30.1/100,,,,adult,2023-01-04 20:29:21.680567
449,Bellin Memorial Hospital,6450420,6450420,IHQCANC,30.0/100,,,,adult,2023-01-04 20:29:21.680567
450,Mercy Hospital Springfield,6631350,6631350,IHQCANC,30.0/100,,,,adult,2023-01-04 20:29:21.680567
451,Alta Bates Summit Medical Center-Berkeley,6930290,6930290,IHQCANC,29.9/100,,,,adult,2023-01-04 20:29:21.680567
452,Frederick Regional Hospital,6320540,6320540,IHQCANC,29.9/100,,,,adult,2023-01-04 20:29:21.680567
453,HCA Florida Osceola Hospital,6390440,6390440,IHQCANC,29.9/100,,,,adult,2023-01-04 20:29:21.680567
454,Henry Ford West Bloomfield Hospital,6440049,6440049,IHQCANC,29.9/100,,,,adult,2023-01-04 20:29:21.680567
455,Miriam Hospital,6150130,6150130,IHQCANC,29.9/100,,,,adult,2023-01-04 20:29:21.680567
456,St. Charles Medical Center,6920070,6920070,IHQCANC,29.9/100,,,,adult,2023-01-04 20:29:21.680567
457,Baptist Medical Center,6740415,6740415,IHQCANC,29.8/100,,,,adult,2023-01-04 20:29:21.680567
458,Hospital of Central Connecticut,6160013,6160013,IHQCANC,29.8/100,,,,adult,2023-01-04 20:29:21.680567
459,Kaiser Permanente Baldwin Park Medical Center,6930098,6930098,IHQCANC,29.8/100,,,,adult,2023-01-04 20:29:21.680567
460,Rochester General Hospital,6214290,6214290,IHQCANC,29.8/100,,,,adult,2023-01-04 20:29:21.680567
461,CentraState Medical Center,6220322,6220322,IHQCANC,29.7/100,,,,adult,2023-01-04 20:29:21.680567
462,Forbes Hospital,6232551,6232551,IHQCANC,29.7/100,,,,adult,2023-01-04 20:29:21.680567
463,Integris Baptist Medical Center,6730728,6730728,IHQCANC,29.7/100,,,,adult,2023-01-04 20:29:21.680567
464,Shannon Medical Center,6740129,6740129,IHQCANC,29.7/100,,,,adult,2023-01-04 20:29:21.680567
465,Sparrow Hospital,6441595,6441595,IHQCANC,29.7/100,,,,adult,2023-01-04 20:29:21.680567
466,St. Luke's Anderson Campus,6230456,6230456,IHQCANC,29.7/100,,,,adult,2023-01-04 20:29:21.680567
467,TMC Healthcare-Tucson,6860020,6860020,IHQCANC,29.7/100,,,,adult,2023-01-04 20:29:21.680567
468,Aultman Hospital,6410280,6410280,IHQCANC,29.6/100,,,,adult,2023-01-04 20:29:21.680567
469,Health First Holmes Regional Medical Center,6390530,6390530,IHQCANC,29.6/100,,,,adult,2023-01-04 20:29:21.680567
470,Swedish American Hospital,6432810,6432810,IHQCANC,29.6/100,,,,adult,2023-01-04 20:29:21.680567
471,UP Health System-Marquette,6441720,6441720,IHQCANC,29.6/100,,,,adult,2023-01-04 20:29:21.680567
472,Virginia Hospital Center,6340040,6340040,IHQCANC,29.6/100,,,,adult,2023-01-04 20:29:21.680567
473,CHI St. Luke's Health-The Woodlands Hospital,6740248,6740248,IHQCANC,29.5/100,,,,adult,2023-01-04 20:29:21.680567
474,Fort Sanders Regional Medical Center,6520510,6520510,IHQCANC,29.5/100,,,,adult,2023-01-04 20:29:21.680567
475,Kaiser Permanente Panorama City Medical Center,6933784,6933784,IHQCANC,29.5/100,,,,adult,2023-01-04 20:29:21.680567
